{
  "contract_version": "context-package/1",
  "package_id": "cp_5c7d9e01",
  "request_id": "cr_2b4f6a80",
  "expansion_contract_version": "context-expansion/1",
  "roots": [
    {
      "id": "ko.rule.sales.proposal-validity",
      "claim": "the change alters when a proposal may still be accepted (selected by root-selector)"
    }
  ],
  "entries": [
    {
      "id": "ko.rule.sales.proposal-validity",
      "content_hash": "sha256:f4decf90cc3200ae0ec23948d629eb6695b8429139785c1d5eb161277bb0c9e3",
      "depth": 0
    },
    {
      "id": "ko.boundary.sales.proposal",
      "content_hash": "sha256:6fcbb9bc73e4fc19fc58829be304c239ad4faf234ea5a5166fbc9689cba50bcb",
      "depth": 1,
      "via": "boundary"
    },
    {
      "id": "ko.definition.sales.proposal",
      "content_hash": "sha256:aa7a633e4c7a6624d5d68fc0c0910080557e19a08d537bf55d04da165d6d8002",
      "depth": 1,
      "via": "depends_on"
    },
    {
      "id": "adr.0001",
      "content_hash": "sha256:4508b26be62edbe3acae01a15b8b1d6e5d9d6355d0cfa33cfe66ba5eb86b599d",
      "depth": 1,
      "via": "governed_by"
    },
    {
      "id": "ko.boundary.sales",
      "content_hash": "sha256:2d33f10c02eea5086e78510a985997e318055d5a5bf2dd7f3754eb82904479a9",
      "depth": 2,
      "via": "boundary"
    },
    {
      "id": "ko.lifecycle.sales.proposal",
      "content_hash": "sha256:4c83d6f167a94c39c2258f905b54d55d0653eb2eec68646091dc39a4cfeb5f8b",
      "depth": 2,
      "via": "attributes[].lifecycle"
    },
    {
      "id": "ko.definition.sales.proposal-item",
      "content_hash": "sha256:af7366490959915275c1917c61fab079a290ba73dd3e671d5320c2b8e02f171d",
      "depth": 2,
      "via": "attributes[].of"
    },
    {
      "id": "ko.definition.sales.customer",
      "content_hash": "sha256:87666b2a0dcf45efd65c044b9127505e75d3e78ab2a2b4f5dce0c4387c2141f9",
      "depth": 2,
      "via": "attributes[].target"
    },
    {
      "id": "ko.boundary.billing",
      "content_hash": "sha256:14160e84c002bf63165496d0af2ead49266cb85def8404c2c504d97919bf3269",
      "depth": 3,
      "via": "context_relationships[].with"
    },
    {
      "id": "ko.definition.sales.proposal-already-issued",
      "content_hash": "sha256:3d4a131d2e0a9ec939c485568565b26adf19d728861630f0c1ad4000937977ad",
      "depth": 3,
      "via": "rejections[].error"
    },
    {
      "id": "ko.definition.sales.proposal-not-issued",
      "content_hash": "sha256:c853e8a25b1550a64620e31de41adeeea2d8df59fdd5e0320fa75b622f73d7a7",
      "depth": 3,
      "via": "rejections[].error"
    },
    {
      "id": "ko.definition.sales.proposal-terminal",
      "content_hash": "sha256:bc356087ee53501f2c1211dedd561e7f8ffb3fc0f945c21de673549eccfb0658",
      "depth": 3,
      "via": "rejections[].error"
    }
  ],
  "budget": {
    "unit": "objects",
    "limit": 12,
    "consumed": 12
  },
  "stop_reason": "budget_exhausted",
  "degradations": [
    {
      "code": "budget_exhausted",
      "subject": "ko.rule.sales.proposal-expiration",
      "evidence": "13 would exceed the objects budget of 12"
    }
  ]
}
